{
  "v": "ACDCCAACAAJSONAARI.",
  "t": "acm",
  "d": "EFPWYInLbS_i5wHeYiRp18FNQNuMUJD5lr5oV8hSSQ3h",
  "u": "0ABwcmVzdG9wbm9uY2UwcmF3",
  "i": "EDB8gKNwzurf33pV2hsyGR9XFOmitDhc0LUzDamcU2JR",
  "rd": "ELUW5D0X0pMFM30ZHZKB997lad86PISushrKkKzlhQrl",
  "s": "EHRFZBO-cwFJ68sAlW8WqanWDiWpAp0QQTQsQ6zlRkZy",
  "a": {
    "d": "EFXE6QOPUfeey81EAPRrVN_fNNHoINy-qslSAGqM8I6O",
    "u": "0ABwcmVzYXR0cm5vbmNlMHJh",
    "i": "EJQON0fDA5FKC14BKbk921e212IctfjLsCL7l46OzHgG",
    "venue": "The Alcove Club, 200 S West Temple, Salt Lake City UT",
    "occurredAt": "2026-07-14T21:30:00.000000+00:00",
    "county": "Beaver"
  },
  "e": {
    "d": "EIYE4Bnn5aDD0od8V1wuZHyGBY_xMiD59t1EPIwZVsf2",
    "u": "0ABwcmVzZWRnZW5vbmNlMHJh",
    "identity": {
      "d": "EEuba8dxONPv6vciQZCsq3QKt4zpDSBHIIixx4F-X8C2",
      "u": "0ABwcmVzaWRlZGdlbm9uY2Uw",
      "n": "EGsPyGCyHtDSWP61rVsRh3F8qooP_jrX6qPHqHn7-FOg",
      "s": "EN0JtdzBmFuTUzyJG9CXZhtdu-bW0V6L95bsVBzi-cY-",
      "o": "I2I"
    },
    "residence": {
      "d": "EEe0jJIX2CfdKhwmUBNtCvjwatx3C0pRkho4kD11peE6",
      "u": "0ABwcmVzYWdlZWRnZW5vbmNl",
      "n": "EBmFqhgpZL_Dc6PLgZBuKtsYfl6ajXYihYLyp7qgcbPb",
      "s": "EH5hn7CbtDFxhS3IKioC8P-e4YyZoxqzhRpr4X_e32BD",
      "o": "I2I"
    }
  },
  "r": "EG8X1nQFCrQ4Rg8BjfE0-BIuKSo1TVbwqymQ3Wuam6VW"
}
